{
  "$schema": "https://json-schema.org/draft/2020-12/schema",
  "$id": "https://github.com/manutej/meta-suite/next/kernel/schemas/claim.schema.json",
  "title": "Claim",
  "description": "One sourced statement, as stored by the kernel (id and stage_token are kernel-issued). Spec: spec/v2/03-architecture.md, Core types. schema_version 2.0.0-alpha.1.",
  "type": "object",
  "additionalProperties": false,
  "properties": {
    "id": {
      "type": "string",
      "pattern": "^[0-9A-HJKMNP-TV-Z]{26}$"
    },
    "subject": {
      "type": "string",
      "minLength": 1,
      "maxLength": 300
    },
    "relation": {
      "type": "string",
      "minLength": 1,
      "maxLength": 100,
      "pattern": "^[a-z][a-z0-9_]*$"
    },
    "object": {
      "type": "string",
      "minLength": 1,
      "maxLength": 300
    },
    "value": {
      "type": [
        "string",
        "number",
        "boolean"
      ]
    },
    "value_type": {
      "enum": [
        "qualitative",
        "numeric",
        "relative"
      ]
    },
    "unit": {
      "type": "string",
      "minLength": 1,
      "maxLength": 40
    },
    "as_of": {
      "type": "string",
      "pattern": "^\\d{4}(-\\d{2}(-\\d{2}([T ]\\d{2}:\\d{2}(:\\d{2}(\\.\\d+)?)?(Z|[+-]\\d{2}:?\\d{2})?)?)?)?$"
    },
    "source": {
      "type": "object",
      "additionalProperties": false,
      "properties": {
        "locator": {
          "type": "string",
          "minLength": 1,
          "maxLength": 2048
        },
        "retrieved_at": {
          "type": "string",
          "format": "date-time"
        },
        "independence_key": {
          "type": "string",
          "minLength": 1,
          "maxLength": 253,
          "pattern": "^\\S(.*\\S)?$"
        }
      },
      "required": [
        "locator",
        "retrieved_at",
        "independence_key"
      ]
    },
    "region": {
      "type": "string",
      "minLength": 1,
      "maxLength": 64,
      "pattern": "^[A-Za-z0-9._-]+$"
    },
    "stage_token": {
      "type": "object",
      "additionalProperties": false,
      "properties": {
        "tid": {
          "type": "string",
          "pattern": "^[0-9A-HJKMNP-TV-Z]{26}$"
        },
        "run": {
          "type": "string",
          "pattern": "^[0-9A-HJKMNP-TV-Z]{26}$"
        },
        "stage": {
          "enum": [
            "I1",
            "I2",
            "I3",
            "D1",
            "D2",
            "D3",
            "L1",
            "L2",
            "L3",
            "L4",
            "G3",
            "G4",
            "A1",
            "A2",
            "R1",
            "R2",
            "S1",
            "S2"
          ]
        },
        "region": {
          "type": "string"
        },
        "agent": {
          "type": "string",
          "minLength": 1,
          "pattern": "^[A-Za-z0-9._-]{1,64}$"
        },
        "model": {
          "type": "string",
          "minLength": 1,
          "maxLength": 128
        },
        "prompt_hash": {
          "type": "string",
          "minLength": 1
        }
      },
      "required": [
        "tid",
        "run",
        "stage",
        "region",
        "agent",
        "model",
        "prompt_hash"
      ]
    },
    "normalized": {
      "type": "object",
      "additionalProperties": false,
      "properties": {
        "dimension": {
          "type": "string",
          "minLength": 1
        },
        "from_unit": {
          "type": "string",
          "minLength": 1
        },
        "from_value": {
          "type": "number"
        }
      },
      "required": [
        "dimension",
        "from_unit",
        "from_value"
      ]
    }
  },
  "required": [
    "id",
    "subject",
    "relation",
    "object",
    "value_type",
    "source",
    "region",
    "stage_token"
  ],
  "allOf": [
    {
      "if": {
        "properties": {
          "value_type": {
            "const": "numeric"
          }
        },
        "required": [
          "value_type"
        ]
      },
      "then": {
        "required": [
          "value"
        ],
        "properties": {
          "value": {
            "type": "number"
          }
        }
      }
    }
  ]
}
