{"id":"01JBQ6Z3V8K4M2N5P7R9T1W3X6","subject":"entity-a","relation":"has_part","object":"entity-b","value_type":"qualitative","source":{"locator":"https://example.org/a","retrieved_at":"2026-10-29T12:00:00Z","independence_key":"example.org"},"region":"r1","stage_token":{"tid":"01JBQ6Z3V8K4M2N5P7R9T1W3X5","run":"01JBQ6Z3V8K4M2N5P7R9T1W3X4","stage":"D2","region":"r1","agent":"gather-r1","model":"model-x","prompt_hash":"0000000000000000000000000000000000000000000000000000000000000000"}}
