{"id":"01JBQ6Z3V8K4M2N5P7R9T1W3X7","subject":"entity-a","relation":"length","object":"entity-a","value":1200,"value_type":"numeric","unit":"m","as_of":"2025-06","source":{"locator":"https://example.org/a","retrieved_at":"2026-10-29T12:00:00Z","independence_key":"example.org"},"region":"r1","stage_token":{"tid":"01JBQ6Z3V8K4M2N5P7R9T1W3X5","run":"01JBQ6Z3V8K4M2N5P7R9T1W3X4","stage":"D2","region":"r1","agent":"gather-r1","model":"model-x","prompt_hash":"0000000000000000000000000000000000000000000000000000000000000000"},"normalized":{"dimension":"length","from_unit":"km","from_value":1.2}}
